,Title,Poem,Poem_for_Human
0,Mirror,am silver and exact have no preconceptions whatever see swallow immediately just as it is unmisted by love or dislike am not cruel only truthful‚ the eye of little god four cornered most of the time meditate on the opposite wall it is pink with speckles have looked at it so long think it is part of my heart but it flickers faces and darkness separate us over and over now am lake woman bends over me searching my reaches for what she really is then she turns to those liars the candles or the moon see her back and reflect it faithfully she rewards me with tears and an agitation of hands am important to her she comes and goes each morning it is her face that replaces the darkness in me she has drowned young girl and in me an old woman rises toward her day after day like terrible fish show analysis,"
	I am silver and exact. I have no preconceptions.
	Whatever I see I swallow immediately
	Just as it is, unmisted by love or dislike.
	I am not cruel, only truthful‚
	The eye of a little god, four-cornered.
	Most of the time I meditate on the opposite wall.
	It is pink, with speckles. I have looked at it so long
	I think it is part of my heart. But it flickers.
	Faces and darkness separate us over and over.
	Now I am a lake. A woman bends over me,
	Searching my reaches for what she really is.
	Then she turns to those liars, the candles or the moon.
	I see her back, and reflect it faithfully.
	She rewards me with tears and an agitation of hands.
	I am important to her. She comes and goes.
	Each morning it is her face that replaces the darkness.
	In me she has drowned a young girl, and in me an old woman
	Rises toward her day after day, like a terrible fish.     Show analysis"
1,Lady Lazarus,have done it again one year in every ten manage it—— sort of walking miracle my skin bright as nazi lampshade my right foot paperweight my face featureless fine jew linen peel off the napkin my enemy do terrify —— the nose the eye pits the full set of teeth the sour breath will vanish in day soon soon the flesh the grave cave ate will be at home on me and smiling woman am only thirty and like the cat have nine times to die this is number three what trash to annihilate each decade what million filaments the peanut crunching crowd shoves in to see them unwrap me hand and foot the big strip tease gentlemen ladies these are my hands my knees may be skin and bone nevertheless am the same identical woman the first time it happened was ten it was an accident the second time meant to last it out and not come back at all rocked shut as seashell they had to call and call and pick the worms off me like sticky pearls dying is an art like everything else do it exceptionally well do it so it feels like hell do it so it feels real guess you could say have call it is easy enough to do it in cell it is easy enough to do it and stay put it is the theatrical comeback in broad day to the same place the same face the same brute amused shout miracle that knocks me out there is charge for the eyeing of my scars there is charge for the hearing of my heart—— it really goes and there is charge very large charge for word or touch or bit of blood or piece of my hair or my clothes so so herr doktor so herr enemy am your opus am your valuable the pure gold baby that melts to shriek turn and burn do not think underestimate your great concern ash ash you poke and stir flesh bone there is nothing there—— cake of soap wedding ring gold filling herr god herr lucifer beware beware out of the ash rise with my red hair and eat men like air show analysis,"
	I have done it again.
	  One year in every ten
	  I manage it——
	 
	  A sort of walking miracle, my skin
	  Bright as a Nazi lampshade,
	  My right foot
	 
	  A paperweight,
	  My face a featureless, fine
	  Jew linen.
	 
	  Peel off the napkin
	  0 my enemy.
	  Do I terrify?——
	 
	  The nose, the eye pits, the full set of teeth?
	  The sour breath
	  Will vanish in a day.
	 
	  Soon, soon the flesh
	  The grave cave ate will be
	  At home on me
	 
	  And I a smiling woman.
	  I am only thirty.
	  And like the cat I have nine times to die.
	 
	  This is Number Three.
	  What a trash
	  To annihilate each decade.
	 
	  What a million filaments.
	  The peanut-crunching crowd
	  Shoves in to see
	 
	  Them unwrap me hand and foot
	  The big strip tease.
	  Gentlemen, ladies
	 
	  These are my hands
	  My knees.
	  I may be skin and bone,
	 
	  Nevertheless, I am the same, identical woman.
	  The first time it happened I was ten.
	  It was an accident.
	 
	  The second time I meant
	  To last it out and not come back at all.
	  I rocked shut
	 
	  As a seashell.
	  They had to call and call
	  And pick the worms off me like sticky pearls.
	 
	  Dying
	  Is an art, like everything else,
	  I do it exceptionally well.
	 
	  I do it so it feels like hell.
	  I do it so it feels real.
	  I guess you could say I've a call.
	 
	  It's easy enough to do it in a cell.
	  It's easy enough to do it and stay put.
	  It's the theatrical
	 
	  Comeback in broad day
	  To the same place, the same face, the same brute
	  Amused shout:
	 
	  'A miracle!'
	  That knocks me out.
	  There is a charge
	 
	  For the eyeing of my scars, there is a charge
	  For the hearing of my heart——
	  It really goes.
	 
	  And there is a charge, a very large charge
	  For a word or a touch
	  Or a bit of blood
	 
	  Or a piece of my hair or my clothes.
	  So, so, Herr Doktor.
	  So, Herr Enemy.
	 
	  I am your opus,
	  I am your valuable,
	  The pure gold baby
	 
	  That melts to a shriek.
	  I turn and burn.
	  Do not think I underestimate your great concern.
	 
	  Ash, ash —-
	  You poke and stir.
	  Flesh, bone, there is nothing there——
	 
	  A cake of soap,
	  A wedding ring,
	  A gold filling.
	 
	  Herr God, Herr Lucifer
	  Beware
	  Beware.
	 
	  Out of the ash
	  I rise with my red hair
	  And I eat men like air.     Show analysis"
2,Daddy,you do not do you do not do any more black shoe in which have lived like foot for thirty years poor and white barely daring to breathe or achoo daddy have had to kill you you died before had time— marble heavy bag full of god ghastly statue with one gray toe big as frisco seal and head in the freakish atlantic where it pours bean green over blue in the waters off the beautiful nauset used to pray to recover you ach du in the german tongue in the polish town scraped flat by the roller of wars wars wars but the name of the town is common my polack friend says there are dozen or two so never could tell where you put your foot your root never could talk to you the tongue stuck in my jaw it stuck in barb wire snare ich ich ich ich could hardly speak thought every german was you and the language obscene an engine an engine chuffing me off like jew jew to dachau auschwitz belsen began to talk like jew think may well be jew the snows of the tyrol the clear beer of vienna are not very pure or true with my gypsy ancestress and my weird luck and my taroc pack and my taroc pack may be bit of jew have always been scared of you with your luftwaffe your gobbledygoo and your neat mustache and your aryan eye bright blue panzer man panzer man you—— not god but swastika so black no sky could squeak through every woman adores fascist the boot in the face the brute brute heart of brute like you you stand at the blackboard daddy in the picture have of you cleft in your chin instead of your foot but no less devil for that no not any less the black man who bit my pretty red heart in two was ten when they buried you at twenty tried to die and get back back back to you thought even the bones would do but they pulled me out of the sack and they stuck me together with glue and then knew what to do made model of you man in black with meinkampf look and love of the rack and the screw and said do do so daddy am finally through the black telephone off at the root the voices just cannot worm through if have killed one man have killed two— the vampire who said he was you and drank my blood for year seven years if you want to know daddy you can lie back now there is stake in your fat black heart and the villagers never liked you they are dancing and stamping on you they always knew it was you daddy daddy you bastard am through show analysis,"You do not do, you do not do
Any more, black shoe
In which I have lived like a foot
For thirty years, poor and white,
Barely daring to breathe or Achoo.

Daddy, I have had to kill you.
You died before I had time—-
Marble-heavy, a bag full of God,
Ghastly statue with one gray toe
Big as a Frisco seal

And a head in the freakish Atlantic
Where it pours bean green over blue
In the waters off the beautiful Nauset.
I used to pray to recover you.
Ach, du.

In the German tongue, in the Polish town
Scraped flat by the roller
Of wars, wars, wars.
But the name of the town is common.
My Polack friend

Says there are a dozen or two.
So I never could tell where you
Put your foot, your root,
I never could talk to you.
The tongue stuck in my jaw.

It stuck in a barb wire snare.
Ich, ich, ich, ich,
I could hardly speak.
I thought every German was you.
And the language obscene

An engine, an engine,
Chuffing me off like a Jew.
A Jew to Dachau, Auschwitz, Belsen.
I began to talk like a Jew.
I think I may well be a Jew.

The snows of the Tyrol, the clear beer of Vienna
Are not very pure or true.
With my gypsy ancestress and my weird luck
And my Taroc pack and my Taroc pack
I may be a bit of a Jew.

I have always been scared of you,
With your Luftwaffe, your gobbledygoo.
And your neat mustache
And your Aryan eye, bright blue.
Panzer-man, panzer-man, O You——

Not God but a swastika
So black no sky could squeak through.
Every woman adores a Fascist,
The boot in the face, the brute
Brute heart of a brute like you.

You stand at the blackboard, daddy,
In the picture I have of you,
A cleft in your chin instead of your foot
But no less a devil for that, no not
Any less the black man who

Bit my pretty red heart in two.
I was ten when they buried you.
At twenty I tried to die
And get back, back, back to you.
I thought even the bones would do.

But they pulled me out of the sack,
And they stuck me together with glue.
And then I knew what to do.
I made a model of you,
A man in black with a Meinkampf look

And a love of the rack and the screw.
And I said I do, I do.
So daddy, I'm finally through.
The black telephone's off at the root,
The voices just can't worm through.

If I've killed one man, I've killed two—-
The vampire who said he was you
And drank my blood for a year,
Seven years, if you want to know.
Daddy, you can lie back now.

There's a stake in your fat black heart
And the villagers never liked you.
They are dancing and stamping on you.
They always knew it was you.
Daddy, daddy, you bastard, I'm through.     Show analysis"
3,Cinderella,the prince leans to the girl in scarlet heels her green eyes slant hair flaring in fan of silver as the rondo slows now reels begin on tilted violins to span the whole revolving tall glass palace hall where guests slide gliding into light like wine rose candles flicker on the lilac wall reflecting in million flagons shine and glided couples all in whirling trance follow holiday revel begun long since until near twelve the strange girl all at once guilt stricken halts pales clings to the prince as amid the hectic music and cocktail talk she hears the caustic ticking of the clock show analysis,"The prince leans to the girl in scarlet heels,
Her green eyes slant, hair flaring in a fan
Of silver as the rondo slows; now reels
Begin on tilted violins to span

The whole revolving tall glass palace hall
Where guests slide gliding into light like wine;
Rose candles flicker on the lilac wall
Reflecting in a million flagons' shine,

And glided couples all in whirling trance
Follow holiday revel begun long since,
Until near twelve the strange girl all at once
Guilt-stricken halts, pales, clings to the prince

As amid the hectic music and cocktail talk
She hears the caustic ticking of the clock.     Show analysis"
4,Tulips,the tulips are too excitable it is winter here look how white everything is how quiet how snowed in am learning peacefulness lying by myself quietly as the light lies on these white walls this bed these hands am nobody have nothing to do with explosions have given my name and my day clothes up to the nurses and my history to the anaesthetist and my body to surgeons they have propped my head between the pillow and the sheet cuff like an eye between two white lids that will not shut stupid pupil it has to take everything in the nurses pass and pass they are no trouble they pass the way gulls pass inland in their white caps doing things with their hands one just the same as another so it is impossible to tell how many there are my body is pebble to them they tend it as water tends to the pebbles it must run over smoothing them gently they bring me numbness in their bright needles they bring me sleep now have lost myself am sick of baggage —— my patent leather overnight case like black pillbox my husband and child smiling out of the family photo their smiles catch onto my skin little smiling hooks have let things slip thirty year old cargo boat stubbornly hanging on to my name and address they have swabbed me clear of my loving associations scared and bare on the green plastic pillowed trolley watched my teaset my bureaus of linen my books sink out of sight and the water went over my head am nun now have never been so pure did not want any flowers only wanted to lie with my hands turned up and be utterly empty how free it is you have no idea how free —— the peacefulness is so big it dazes you and it asks nothing name tag few trinkets it is what the dead close on finally imagine them shutting their mouths on it like communion tablet the tulips are too red in the first place they hurt me even through the gift paper could hear them breathe lightly through their white swaddlings like an awful baby their redness talks to my wound it corresponds they are subtle they seem to float though they weigh me down upsetting me with their sudden tongues and their colour dozen red lead sinkers round my neck nobody watched me before now am watched the tulips turn to me and the window behind me where once day the light slowly widens and slowly thins and see myself flat ridiculous cut paper shadow between the eye of the sun and the eyes of the tulips and have no face have wanted to efface myself the vivid tulips eat my oxygen before they came the air was calm enough coming and going breath by breath without any fuss then the tulips filled it up like loud noise now the air snags and eddies round them the way river snags and eddies round sunken rust red engine they concentrate my attention that was happy playing and resting without committing itself the walls also seem to be warming themselves the tulips should be behind bars like dangerous animals they are opening like the mouth of some great african cat and am aware of my heart it opens and closes its bowl of red blooms out of sheer love of me the water taste is warm and salty like the sea and comes from country far away as health show analysis,"The tulips are too excitable, it is winter here.
Look how white everything is, how quiet, how snowed-in
I am learning peacefulness, lying by myself quietly
As the light lies on these white walls, this bed, these hands.
I am nobody; I have nothing to do with explosions.
I have given my name and my day-clothes up to the nurses
And my history to the anaesthetist and my body to surgeons.

They have propped my head between the pillow and the sheet-cuff
Like an eye between two white lids that will not shut.
Stupid pupil, it has to take everything in.
The nurses pass and pass, they are no trouble,
They pass the way gulls pass inland in their white caps,
Doing things with their hands, one just the same as another,
So it is impossible to tell how many there are.

My body is a pebble to them, they tend it as water
Tends to the pebbles it must run over, smoothing them gently.
They bring me numbness in their bright needles, they bring me sleep.
Now I have lost myself I am sick of baggage ——
My patent leather overnight case like a black pillbox,
My husband and child smiling out of the family photo;
Their smiles catch onto my skin, little smiling hooks.

I have let things slip, a thirty-year-old cargo boat
Stubbornly hanging on to my name and address.
They have swabbed me clear of my loving associations.
Scared and bare on the green plastic-pillowed trolley
I watched my teaset, my bureaus of linen, my books
Sink out of sight, and the water went over my head.
I am a nun now, I have never been so pure.

I didn't want any flowers, I only wanted
To lie with my hands turned up and be utterly empty.
How free it is, you have no idea how free ——
The peacefulness is so big it dazes you,
And it asks nothing, a name tag, a few trinkets.
It is what the dead close on, finally; I imagine them
Shutting their mouths on it, like a Communion tablet.

The tulips are too red in the first place, they hurt me.
Even through the gift paper I could hear them breathe
Lightly, through their white swaddlings, like an awful baby.
Their redness talks to my wound, it corresponds.
They are subtle: they seem to float, though they weigh me down,
Upsetting me with their sudden tongues and their colour,
A dozen red lead sinkers round my neck.

Nobody watched me before, now I am watched.
The tulips turn to me, and the window behind me
Where once a day the light slowly widens and slowly thins,
And I see myself, flat, ridiculous, a cut-paper shadow
Between the eye of the sun and the eyes of the tulips,
And I have no face, I have wanted to efface myself.
The vivid tulips eat my oxygen.

Before they came the air was calm enough,
Coming and going, breath by breath, without any fuss.
Then the tulips filled it up like a loud noise.
Now the air snags and eddies round them the way a river
Snags and eddies round a sunken rust-red engine.
They concentrate my attention, that was happy
Playing and resting without committing itself.

The walls, also, seem to be warming themselves.
The tulips should be behind bars like dangerous animals;
They are opening like the mouth of some great African cat,
And I am aware of my heart: it opens and closes
Its bowl of red blooms out of sheer love of me.
The water I taste is warm and salty, like the sea,
And comes from a country far away as health.     Show analysis"
5,A Birthday Present,what is this behind this veil is it ugly is it beautiful it is shimmering has it breasts has it edges am sure it is unique am sure it is what want when am quiet at my cooking feel it looking feel it thinking is this the one am too appear for is this the elect one the one with black eye pits and scar measuring the flour cutting off the surplus adhering to rules to rules to rules is this the one for the annunciation my god what laugh but it shimmers it does not stop and think it wants me would not mind if it were bones or pearl button do not want much of present anyway this year after all am alive only by accident would have killed myself gladly that time any possible way now there are these veils shimmering like curtains the diaphanous satins of january window white as babies bedding and glittering with dead breath ivory it must be tusk there ghost column can you not see do not mind what it is can you not give it to me do not be ashamed—i do not mind if it is small do not be mean am ready for enormity let us sit down to it one on either side admiring the gleam the glaze the mirrory variety of it let us eat our last supper at it like hospital plate know why you will not give it to me you are terrified the world will go up in shriek and your head with it bossed brazen an antique shield marvel to your great grandchildren do not be afraid it is not so will only take it and go aside quietly you will not even hear me opening it no paper crackle no falling ribbons no scream at the end do not think you credit me with this discretion if you only knew how the veils were killing my days to you they are only transparencies clear air but my god the clouds are like cotton armies of them they are carbon monoxide sweetly sweetly breathe in filling my veins with invisibles with the million probable motes that tick the years off my life you are silver suited for the occasion adding machine—— is it impossible for you to let something go and have it go whole must you stamp each piece purple must you kill what you can there is one thing want today and only you can give it to me it stands at my window big as the sky it breathes from my sheets the cold dead center where split lives congeal and stiffen to history let it not come by the mail finger by finger let it not come by word of mouth should be sixty by the time the whole of it was delivered and to numb to use it only let down the veil the veil the veil if it were death would admire the deep gravity of it its timeless eyes would know you were serious there would be nobility then there would be birthday and the knife not carve but enter pure and clean as the cry of baby and the universe slide from my side show analysis,"What is this, behind this veil, is it ugly, is it beautiful?
It is shimmering, has it breasts, has it edges?

I am sure it is unique, I am sure it is what I want.
When I am quiet at my cooking I feel it looking, I feel it thinking

'Is this the one I am too appear for,
Is this the elect one, the one with black eye-pits and a scar?

Measuring the flour, cutting off the surplus,
Adhering to rules, to rules, to rules.

Is this the one for the annunciation?
My god, what a laugh!'

But it shimmers, it does not stop, and I think it wants me.
I would not mind if it were bones, or a pearl button.

I do not want much of a present, anyway, this year.
After all I am alive only by accident.

I would have killed myself gladly that time any possible way.
Now there are these veils, shimmering like curtains,

The diaphanous satins of a January window
White as babies' bedding and glittering with dead breath. O ivory!

It must be a tusk there, a ghost column.
Can you not see I do not mind what it is.

Can you not give it to me?
Do not be ashamed—I do not mind if it is small.

Do not be mean, I am ready for enormity.
Let us sit down to it, one on either side, admiring the gleam,

The glaze, the mirrory variety of it.
Let us eat our last supper at it, like a hospital plate.

I know why you will not give it to me,
You are terrified

The world will go up in a shriek, and your head with it,
Bossed, brazen, an antique shield,

A marvel to your great-grandchildren.
Do not be afraid, it is not so.

I will only take it and go aside quietly.
You will not even hear me opening it, no paper crackle,

No falling ribbons, no scream at the end.
I do not think you credit me with this discretion.

If you only knew how the veils were killing my days.
To you they are only transparencies, clear air.

But my god, the clouds are like cotton.
Armies of them. They are carbon monoxide.

Sweetly, sweetly I breathe in,
Filling my veins with invisibles, with the million

Probable motes that tick the years off my life.
You are silver-suited for the occasion. O adding machine——-

Is it impossible for you to let something go and have it go whole?
Must you stamp each piece purple,

Must you kill what you can?
There is one thing I want today, and only you can give it to me.

It stands at my window, big as the sky.
It breathes from my sheets, the cold dead center

Where split lives congeal and stiffen to history.
Let it not come by the mail, finger by finger.

Let it not come by word of mouth, I should be sixty
By the time the whole of it was delivered, and to numb to use it.

Only let down the veil, the veil, the veil.
If it were death

I would admire the deep gravity of it, its timeless eyes.
I would know you were serious.

There would be a nobility then, there would be a birthday.
And the knife not carve, but enter

Pure and clean as the cry of a baby,
And the universe slide from my side.

     Show analysis"
