,Title,Poem,Poem_for_Human
6,Suicide Off Egg Rock,behind him the hotdogs split and drizzled on the public grills and the ochreous salt flats gas tanks factory stacks that landscape of imperfections his bowels were part of rippled and pulsed in the glassy updraught sun struck the water like damnation no pit of shadow to crawl into and his blood beating the old tattoo am am am children were squealing where combers broke and the spindrift raveled wind ripped from the crest of the wave mongrel working his legs to gallop hustled gull flock to flap off the sandspit he smoldered as if stone deaf blindfold his body beached with the sea garbage machine to breathe and beat forever flies filing in through dead skate eyehole buzzed and assailed the vaulted brainchamber the words in his book wormed off the pages everything glittered like blank paper everything shrank in the sun corrosive ray but egg rock on the blue wastage he heard when he walked into the water the forgetful surf creaming on those ledges show analysis,"Behind him the hotdogs split and drizzled
On the public grills, and the ochreous salt flats,
Gas tanks, factory stacks- that landscape
Of imperfections his bowels were part of-
Rippled and pulsed in the glassy updraught.
Sun struck the water like a damnation.
No pit of shadow to crawl into,
And his blood beating the old tattoo
I am, I am, I am. Children
Were squealing where combers broke and the spindrift
Raveled wind-ripped from the crest of the wave.
A mongrel working his legs to a gallop
Hustled a gull flock to flap off the sandspit.

He smoldered, as if stone-deaf, blindfold,
His body beached with the sea's garbage,
A machine to breathe and beat forever.
Flies filing in through a dead skate's eyehole
Buzzed and assailed the vaulted brainchamber.
The words in his book wormed off the pages.
Everything glittered like blank paper.

Everything shrank in the sun's corrosive
Ray but Egg Rock on the blue wastage.
He heard when he walked into the water

The forgetful surf creaming on those ledges.     Show analysis"
7,The Rabbit Catcher,it was place of force—the wind gagging my mouth with my own blown hair tearing off my voice and the seablinding me with its lights the lives of the deadunreeling in it spreading like oil tasted the malignity of the gorse its black spikes the extreme unction of its yellow candle flowers they had an efficiency great beauty and were extravagant like torture there was only one place to get to simmering perfumed the paths narrowed into the hollow and the snares almost effaced themselves—zeros shutting on nothing set close like birth pangs the absence of shrieksmade hole in the hot day vacancy the glassy light was clear wall the thickets quiet felt still busyness an intent felt hands round tea mug dull blunt ringing the white china how they awaited him those little deaths they waited like sweethearts they excited him and we too had relationship—tight wires between us pegs too deep to uproot and mind like ringsliding shut on some quick thing the constriction killing me also show analysis,"It was a place of force—The wind gagging my mouth with my own blown hair,Tearing off my voice, and the seaBlinding me with its lights, the lives of the deadUnreeling in it, spreading like oil.I tasted the malignity of the gorse,Its black spikes,The extreme unction of its yellow candle-flowers.They had an efficiency, a great beauty,And were extravagant, like torture.There was only one place to get to.Simmering, perfumed,The paths narrowed into the hollow.And the snares almost effaced themselves—Zeros, shutting on nothing,Set close, like birth pangs.The absence of shrieksMade a hole in the hot day, a vacancy.The glassy light was a clear wall,The thickets quiet.I felt a still busyness, an intent.I felt hands round a tea mug, dull, blunt,Ringing the white china.How they awaited him, those little deaths!They waited like sweethearts. They excited him.And we, too, had a relationship—Tight wires between us,Pegs too deep to uproot, and a mind like a ringSliding shut on some quick thing,The constriction killing me also.     Show analysis"
8,Morning Song,love set you going like fat gold watch the midwife slapped your footsoles and your bald cry took its place among the elements our voices echo magnifying your arrival new statue in drafty museum your nakedness shadows our safety we stand round blankly as walls am no more your mother than the cloud that distills mirror to reflect its own slow effacement at the wind hand all night your moth breath flickers among the flat pink roses wake to listen far sea moves in my ear one cry and stumble from bed cow heavy and floral in my victorian nightgown your mouth opens clean as cat the window square whitens and swallows its dull stars and now you try your handful of notes the clear vowels rise like balloons show analysis,"Love set you going like a fat gold watch.
	The midwife slapped your footsoles, and your bald cry
	Took its place among the elements.

	Our voices echo, magnifying your arrival.  New statue.
	In a drafty museum, your nakedness
	Shadows our safety.  We stand round blankly as walls.

	I'm no more your mother 
	Than the cloud that distills a mirror to reflect its own slow
	Effacement at the wind's hand.

	All night your moth-breath
	Flickers among the flat pink roses.  I wake to listen:
	A far sea moves in my ear.

	One cry, and I stumble from bed, cow-heavy and floral
	In my Victorian nightgown.
	Your mouth opens clean as a cat's.  The window square

	Whitens and swallows its dull stars.  And now you try
	Your handful of notes;
	The clear vowels rise like balloons.     Show analysis"
9,Edge,the woman is perfected her dead body wears the smile of accomplishment the illusion of greek necessity flows in the scrolls of her toga her bare feet seem to be saying we have come so far it is over each dead child coiled white serpent one at each little pitcher of milk now empty she has folded them back into her body as petals of rose close when the garden stiffens and odors bleed from the sweet deep throats of the night flower the moon has nothing to be sad about staring from her hood of bone she is used to this sort of thing her blacks crackle and drag show analysis,"The woman is perfected
	Her dead

	Body wears the smile of accomplishment,
	The illusion of a Greek necessity

	Flows in the scrolls of her toga,
	Her bare

	Feet seem to be saying:
	We have come so far, it is over.

	Each dead child coiled, a white serpent,
	One at each little

	Pitcher of milk, now empty
	She has folded

	Them back into her body as petals
	Of a rose close when the garden

	Stiffens and odors bleed
	From the sweet, deep throats of the night flower.

	The moon has nothing to be sad about,
	Staring from her hood of bone.

	She is used to this sort of thing.
	Her blacks crackle and drag.     Show analysis"
